,dataset,summary
0,2019_12_negative,"The text discusses the controversy surrounding vaccinations, with many expressing skepticism or outright rejection of vaccines while making claims about health and conspiracy theories. Some emphasize personal anecdotes of children being fine without vaccinations, while others express frustration at the anti-vaccine sentiment, linking it to broader issues like misinformation and ignorance. The discourse touches on various topics, from health to politics, and highlights a general trend of distrust in science and public health initiatives."
1,2019_11_negative,"The text discusses various opinions and concerns about vaccination, with a strong focus on the anti-vaccine sentiment observed among certain individuals and communities. It highlights fears regarding the return of diseases like measles due to low vaccination rates, as well as personal anecdotes about the discomfort and side effects of vaccinations. The text also addresses the spread of misinformation surrounding vaccines, linking it to broader societal issues such as distrust in government and science. Overall, it reflects a significant public health concern regarding vaccination hesitancy and its consequences."
2,2019_10_negative,"The provided text discusses various opinions and experiences related to vaccination, particularly focusing on the reluctance or refusal of some parents to vaccinate their children. Many express discomfort and fear regarding vaccinations, while others highlight the importance of vaccines for public health. It also notes the increasing prevalence of diseases like measles due to declining vaccination rates, as well as frustrations with the availability of vaccines in health facilities. Some individuals humorously reference their own experiences with needles and the reluctance to receive vaccinations, while others criticize anti-vaccine sentiments and the implications for community health. Overall, the discussion underscores the tension between personal beliefs and public health needs surrounding vaccination."
3,2019_09_negative,"The text discusses concerns about declining vaccination rates, particularly for children, which may lead to outbreaks of diseases like measles. It highlights personal anecdotes of individuals expressing reluctance or refusal to vaccinate their children, often citing their perceived health as justification. Additionally, it mentions the impact of government budget cuts on vaccination programs and public health, raising alarm about the potential consequences of these decisions."
4,2019_08_negative,"A text discusses the tragic consequences of the anti-vaccination movement, highlighting a mother's loss of her two children to measles after refusing to vaccinate them, influenced by figures like Olavo de Carvalho in Brazil. The text emphasizes the importance of vaccinating children to prevent such tragedies, condemning the misinformation surrounding vaccines."
5,2019_07_negative,"The messages discuss the controversial topic of vaccination, particularly in the context of children. Many parents claim their children are healthy despite not being vaccinated, while others express fears, frustrations, and experiences related to vaccinations. The dialogues reflect a mix of skepticism towards vaccines, personal anecdotes about the pain associated with them, and concerns about public health due to lower vaccination rates. There are also references to broader societal issues, including political influences on public health and misinformation surrounding vaccines."
6,2019_06_negative,"The sentences express various opinions and experiences related to vaccination. Many individuals share their discomfort and pain after receiving vaccines, particularly for the flu, and express frustration about the process, including long waits and insufficient availability. There's a recurring theme of skepticism towards vaccines, with some claiming they don't need them or that their children are fine without them. The discussion also touches on broader societal concerns regarding vaccination rates, misinformation, and public health. The overall sentiment reflects a mix of humor, frustration, and fear surrounding the act of vaccination and its implications for health."
7,2019_05_negative,"The texts discuss the belief that children who have not been vaccinated can still be healthy, as expressed by various parents claiming their unvaccinated children are doing well. Additionally, there are mentions of vaccination campaigns, personal experiences with vaccine side effects, and a general skepticism towards vaccinations, often framed within broader debates about health and government trust."
8,2019_04_negative,"The text discusses various opinions and reactions about vaccines, particularly the COVID-19 vaccine, revealing a divided public sentiment. Some express skepticism, believing vaccines are part of a government scheme or claim their children are fine without vaccination. Others emphasize the importance of vaccination for public health and criticize anti-vaccine sentiments. Reactions to receiving vaccines include pain and discomfort, showcasing the emotional struggle many feel towards vaccination. Overall, the conversation highlights significant misinformation and the social implications of vaccine hesitancy."
9,2019_03_negative,"The text discusses the controversy surrounding former Brazilian president Lula's veto of a meningitis vaccine in 2010, which is claimed to have contributed to the death of his grandson. Many comments link Lula's actions to broader issues of corruption and health care failures in Brazil, emphasizing the tragic consequences of not vaccinating children, including the resurgence of preventable diseases. Critics express anger over the veto, arguing that it reflects negligence towards public health, while supporters of Lula dismiss these claims as misinformation."
10,2019_02_negative,"The text reflects a wide range of sentiments regarding vaccinations, including personal experiences, fears, and frustrations. Many express pain and discomfort after receiving vaccines, while others criticize the anti-vaccine movement for its potential dangers to public health. There's also mention of misinformation and the impact of fake news on vaccination rates. Overall, the narrative illustrates a societal struggle with vaccine acceptance, fear, and the consequences of falling prey to disinformation."
11,2019_01_negative,"The text discusses the case of a prominent conservative writer and anti-vaccine activist who died from H1N1 influenza at age 26. Many comments reflect on the irony of her death due to diseases preventable by vaccination, highlighting the dangers of anti-vaccine beliefs. The text captures widespread concern about the anti-vaccine movement and its potential public health consequences."
