,dataset,summary
0,2015_01_neutral,"The text discusses various aspects of vaccinations, including reminders for specific vaccines like HPV and anti-rabies, public health campaigns, and personal anecdotes about getting vaccinated. It also mentions ongoing clinical trials for vaccines against diseases like Ebola, the importance of vaccination in preventing outbreaks (e.g., measles), and societal attitudes towards vaccination. The overall tone reflects a mix of humor, concern, and awareness about the necessity of maintaining vaccination schedules for both children and adults."
1,2015_02_neutral,"The text discusses various aspects of vaccination, including government campaigns, public health issues related to vaccine availability (like shortages of BCG and HPV vaccines), and societal attitudes towards vaccines. It touches on debates over mandatory vaccination, controversies about the HPV vaccine and its effects on sexual behavior, and the resurgence of diseases like measles due to vaccination hesitancy. Additionally, it highlights the importance of vaccination in preventing outbreaks and maintaining public health."
2,2015_03_neutral,"A vaccination campaign against HPV is starting in various regions of Brazil, targeting girls aged 9 to 11. Despite the importance of the vaccine in preventing cervical cancer, there is a low uptake reported in many areas. The Ministry of Health is working to raise awareness and increase participation in the vaccination program."
3,2015_04_neutral,"The text discusses various vaccination campaigns in Brazil, including the government's decision to eliminate import taxes on HPV vaccines, the initiation of campaigns for flu and other vaccines, and efforts to vaccinate specific populations such as children, the elderly, and livestock. There are mentions of vaccination logistics, public health initiatives, and community responses, highlighting the importance of vaccination in disease prevention."
4,2015_05_neutral,"The sentences discuss the ongoing vaccination campaigns against influenza (the flu) and other diseases in Brazil. Numerous health posts are starting these campaigns, focusing on vaccinating priority groups such as children, elderly individuals, and pregnant women. There's also a mention of a new meningitis B vaccine. Several municipalities are struggling to meet vaccination targets, leading to extensions of these campaigns. Additionally, there are references to public health discussions and the importance of vaccinations in preventing outbreaks."
5,2015_06_neutral,"The texts discuss the vaccination campaigns against influenza in Brazil, emphasizing the importance of reaching vaccination targets and the need for awareness and participation. They highlight that some regions, like Acre, failed to meet vaccination goals, while others, like Alagoas, achieved them. Various municipalities extended their vaccination periods due to low participation rates and targeted different demographics, including teachers and police. The overall message stresses the significance of vaccination in public health efforts."
6,2015_07_neutral,"A vaccination campaign against rabies for dogs and cats has begun in the rural areas of Nova Serrana, running until July 31. There are also discussions about vaccination against other diseases, such as influenza and meningitis, with various localities addressing low vaccination rates and public health concerns."
7,2015_08_neutral,"The text discusses multiple vaccination campaigns in Brazil, primarily focusing on the vaccination against poliomyelitis (polio) and rabies for pets. It highlights the start dates, objectives, and participation rates of these campaigns, urging parents to bring their children for vaccination. Additionally, it mentions the need for vaccinations against other diseases like meningitis and HPV, emphasizing the importance of maintaining vaccination records. The overall tone conveys a sense of urgency to ensure public health through immunization."
8,2015_09_neutral,"The texts discuss various vaccination campaigns in Brazil, particularly for the polio and HPV vaccines. Many regions are extending their vaccination efforts due to not meeting targets, while some areas have successfully achieved their goals. The importance of vaccinating children and adolescents against preventable diseases is emphasized, alongside challenges in public participation and awareness."
9,2015_10_neutral,"The text primarily discusses various vaccination campaigns and their importance in preventing diseases for both humans and animals. It highlights the rollout of vaccines against diseases like HPV, dengue, and rabies, as well as mentions specific events and campaigns in different regions. There are also references to personal experiences with vaccinations, humor related to vaccination fears, and the role of vaccination in public health initiatives."
10,2015_11_neutral,"The text discusses various campaigns and phases of vaccination against foot-and-mouth disease affecting livestock in Brazil, emphasizing the importance of vaccinating the herd to maintain disease-free status. It highlights deadlines for vaccination, awareness campaigns for rural producers, and the impact on meat exportation."
11,2015_12_neutral,"The text discusses various aspects of vaccination, particularly focusing on the approval and details of the first dengue vaccine in Brazil by Anvisa. It addresses the target demographics for the vaccine, including children up to 14 years and elderly over 60, while noting concerns about the spread of misinformation relating to other vaccines, such as those for rubella and Zika."
